{
  "schema_version": "1.0.0",
  "content_version": "0.1.2",
  "resolution_set_id": "cgr_sg_seab_h2_math_9758_2026_outcomes",
  "gap_set_id": "cgs_sg_seab_h2_math_9758_2026_outcomes",
  "framework_id": "cfw_sg_seab_h2_math_9758_2026_outcomes",
  "curriculum_id": "cur_sg_seab_h2_math_9758_2026",
  "subject": "Mathematics",
  "source_ids": [
    "src_sg_seab_h2_math_9758_2026",
    "src_openstax_precalculus_2e_2026",
    "src_mit_ocw_18_02sc_fall_2010",
    "src_mit_ocw_strang_calculus_ch9_2023",
    "src_mit_ocw_18_01sc_fall_2010",
    "src_openstax_introductory_statistics_2e_2026",
    "src_berkeley_cs70_summer_2026"
  ],
  "generated_at": "2026-07-19",
  "review_status": "approved",
  "changelog": [
    {
      "version": "0.1.0",
      "date": "2026-07-19",
      "summary_zh": "完成 33 项 H2 数学概念缺口的全库查重、最小诊断粒度新增和双类权威证据登记。"
    },
    {
      "version": "0.1.1",
      "date": "2026-10-25",
      "summary_zh": "依据 2026-10 联网复核修正描述、证据定位与映射覆盖，状态保持 needs_review。"
    },
    {
      "version": "0.1.2",
      "date": "2026-10-25",
      "summary_zh": "完成联网复核与人工批准。"
    }
  ],
  "resolutions": [
    {
      "gap_id": "gap_sg_h2_math_9758_2026_o_inverse_existence_restriction",
      "resolution_action": "add_or_alias_concepts",
      "canonical_ids": [
        "pc_5f10437c0846188d853443ee76c29385",
        "pc_d547d8eb03df4b28cc0357c7cae1d164"
      ],
      "created_node_ids": [
        "sg_h2_math_inverse_existence_restriction"
      ],
      "practice_ids": [],
      "rationale_zh": "全库反向查重后，现有概念只能覆盖基础或更宽范围；新增一个与官方成果一致的最小可诊断概念，并保留相关 canonical 作为基础映射。",
      "evidence_refs": [
        {
          "source_id": "src_sg_seab_h2_math_9758_2026",
          "locator": "PDF p.6, sub-topic 1.1 Functions"
        },
        {
          "source_id": "src_openstax_precalculus_2e_2026",
          "locator": "PDF §1.7 Inverse Functions, printed pp.130-149"
        }
      ],
      "review_status": "approved"
    },
    {
      "gap_id": "gap_sg_h2_math_9758_2026_o_standard_graph_characteristics",
      "resolution_action": "add_or_alias_concepts",
      "canonical_ids": [
        "pc_01bf6e2b919084e9537bb1dae27d1509",
        "pc_133d40fa0e72c29c5eb6ec7a9852c80c",
        "pc_58591fb3c8294a83a9405568a100991e",
        "pc_76707a52fc4d807bbdfb0e56f509c17e",
        "pc_d236c68eb711f9a26eb4250a7843b517",
        "pc_2fd09e919b7e73069c83ce49007f17d2"
      ],
      "created_node_ids": [
        "sg_h2_math_standard_graph_characteristics"
      ],
      "practice_ids": [],
      "rationale_zh": "全库反向查重后，现有概念只能覆盖基础或更宽范围；新增一个与官方成果一致的最小可诊断概念，并保留相关 canonical 作为基础映射。",
      "evidence_refs": [
        {
          "source_id": "src_sg_seab_h2_math_9758_2026",
          "locator": "PDF p.6, sub-topic 1.2 Graphs and transformations"
        },
        {
          "source_id": "src_openstax_precalculus_2e_2026",
          "locator": "PDF §§3.2 and 3.7, printed pp.255-274 and 340-364; §§10.1-10.3, printed pp.1010-1055"
        }
      ],
      "review_status": "approved"
    },
    {
      "gap_id": "gap_sg_h2_math_9758_2026_o_parametric_graphs",
      "resolution_action": "add_or_alias_concepts",
      "canonical_ids": [
        "pc_044eaaf9e74e43e4aee3e6898c91a012"
      ],
      "created_node_ids": [
        "sg_h2_math_parametric_graphs"
      ],
      "practice_ids": [],
      "rationale_zh": "全库反向查重后，现有概念只能覆盖基础或更宽范围；新增一个与官方成果一致的最小可诊断概念，并保留相关 canonical 作为基础映射。",
      "evidence_refs": [
        {
          "source_id": "src_sg_seab_h2_math_9758_2026",
          "locator": "PDF p.6, sub-topic 1.2 Graphs and transformations"
        },
        {
          "source_id": "src_openstax_precalculus_2e_2026",
          "locator": "PDF §§8.6-8.7 Parametric Equations and Graphs, printed pp.839-863"
        }
      ],
      "review_status": "approved"
    },
    {
      "gap_id": "gap_sg_h2_math_9758_2026_o_formulate_equations",
      "resolution_action": "add_or_alias_concepts",
      "canonical_ids": [
        "pc_2c7c77c12eaf42efced7f2a956e1bb16",
        "pc_204206c0b72ea40b72d3055124b579af",
        "pc_4307437065fb6fce9aa3b4c05e7ed82d"
      ],
      "created_node_ids": [
        "sg_h2_math_formulate_equations"
      ],
      "practice_ids": [],
      "rationale_zh": "全库反向查重后，现有概念只能覆盖基础或更宽范围；新增一个与官方成果一致的最小可诊断概念，并保留相关 canonical 作为基础映射。",
      "evidence_refs": [
        {
          "source_id": "src_sg_seab_h2_math_9758_2026",
          "locator": "PDF p.7, sub-topic 1.3 Equations and inequalities"
        },
        {
          "source_id": "src_openstax_precalculus_2e_2026",
          "locator": "PDF §2.3 Modeling with Linear Functions, printed pp.206-219; §§9.1-9.3, printed pp.896-936"
        }
      ],
      "review_status": "approved"
    },
    {
      "gap_id": "gap_sg_h2_math_9758_2026_o_rational_quadratic_inequalities",
      "resolution_action": "add_or_alias_concepts",
      "canonical_ids": [
        "pc_afd49425ab0864c75dcf18868acbba73",
        "pc_4307437065fb6fce9aa3b4c05e7ed82d"
      ],
      "created_node_ids": [
        "sg_h2_math_rational_quadratic_inequalities"
      ],
      "practice_ids": [],
      "rationale_zh": "全库反向查重后，现有概念只能覆盖基础或更宽范围；新增一个与官方成果一致的最小可诊断概念，并保留相关 canonical 作为基础映射。",
      "evidence_refs": [
        {
          "source_id": "src_sg_seab_h2_math_9758_2026",
          "locator": "PDF p.7, sub-topic 1.3 Equations and inequalities"
        },
        {
          "source_id": "src_openstax_precalculus_2e_2026",
          "locator": "PDF §3.7 Rational Functions, printed pp.340-364; §9.3 Nonlinear Equations and Inequalities, printed pp.925-936"
        }
      ],
      "review_status": "approved"
    },
    {
      "gap_id": "gap_sg_h2_math_9758_2026_o_recurrence_sequences",
      "resolution_action": "add_or_alias_concepts",
      "canonical_ids": [
        "pc_751f6453ef98be2b89e76c9a253bef03"
      ],
      "created_node_ids": [
        "sg_h2_math_recurrence_sequences"
      ],
      "practice_ids": [],
      "rationale_zh": "全库反向查重后，现有概念只能覆盖基础或更宽范围；新增一个与官方成果一致的最小可诊断概念，并保留相关 canonical 作为基础映射。",
      "evidence_refs": [
        {
          "source_id": "src_sg_seab_h2_math_9758_2026",
          "locator": "PDF p.7, sub-topic 2.1 Sequences and series"
        },
        {
          "source_id": "src_openstax_precalculus_2e_2026",
          "locator": "PDF §11.1 Sequences and Their Notations, printed pp.1089-1103"
        }
      ],
      "review_status": "approved"
    },
    {
      "gap_id": "gap_sg_h2_math_9758_2026_o_series_operations_convergence",
      "resolution_action": "add_or_alias_concepts",
      "canonical_ids": [
        "pc_08b1eb5f8f685706a847adee808f59f9",
        "pc_105655e3b7f36e0d0c2488e7d3e47a3a"
      ],
      "created_node_ids": [
        "sg_h2_math_series_operations_convergence"
      ],
      "practice_ids": [],
      "rationale_zh": "全库反向查重后，现有概念只能覆盖基础或更宽范围；新增一个与官方成果一致的最小可诊断概念，并保留相关 canonical 作为基础映射。",
      "evidence_refs": [
        {
          "source_id": "src_sg_seab_h2_math_9758_2026",
          "locator": "PDF p.7, sub-topic 2.1 Sequences and series"
        },
        {
          "source_id": "src_openstax_precalculus_2e_2026",
          "locator": "PDF §11.4 Series and Their Notations, printed pp.1124-1136"
        }
      ],
      "review_status": "approved"
    },
    {
      "gap_id": "gap_sg_h2_math_9758_2026_o_vector_operations_geometry",
      "resolution_action": "add_or_alias_concepts",
      "canonical_ids": [
        "pc_d4b7e2b6e2c8459d849405a8f6fc0b79",
        "pc_9ae5f17312ee21050edf3e4bd9b005a2"
      ],
      "created_node_ids": [
        "sg_h2_math_vector_operations_geometry"
      ],
      "practice_ids": [],
      "rationale_zh": "全库反向查重后，现有概念只能覆盖基础或更宽范围；新增一个与官方成果一致的最小可诊断概念，并保留相关 canonical 作为基础映射。",
      "evidence_refs": [
        {
          "source_id": "src_sg_seab_h2_math_9758_2026",
          "locator": "PDF p.7, sub-topic 3.1 Basic properties of vectors"
        },
        {
          "source_id": "src_mit_ocw_18_02sc_fall_2010",
          "locator": "Unit 1 Part A, Sessions 1-4: vectors, dot products, lengths, angles and components"
        }
      ],
      "review_status": "approved"
    },
    {
      "gap_id": "gap_sg_h2_math_9758_2026_o_vector_types_magnitude",
      "resolution_action": "add_or_alias_concepts",
      "canonical_ids": [
        "pc_621b21298876e61af0ada0dde5521dd6",
        "pc_9ae5f17312ee21050edf3e4bd9b005a2",
        "pc_64e61e1cee5471619fa54db48800b916"
      ],
      "created_node_ids": [
        "sg_h2_math_vector_types_magnitude"
      ],
      "practice_ids": [],
      "rationale_zh": "全库反向查重后，现有概念只能覆盖基础或更宽范围；新增一个与官方成果一致的最小可诊断概念，并保留相关 canonical 作为基础映射。",
      "evidence_refs": [
        {
          "source_id": "src_sg_seab_h2_math_9758_2026",
          "locator": "PDF p.7, sub-topic 3.1 Basic properties of vectors"
        },
        {
          "source_id": "src_mit_ocw_18_02sc_fall_2010",
          "locator": "Unit 1 Part A, Sessions 1-4: vector components, lengths and directions"
        }
      ],
      "review_status": "approved"
    },
    {
      "gap_id": "gap_sg_h2_math_9758_2026_o_collinearity_ratio",
      "resolution_action": "add_or_alias_concepts",
      "canonical_ids": [
        "pc_c4a9b18aaa8cac61cd5719c4de9d6879",
        "pc_9ae5f17312ee21050edf3e4bd9b005a2"
      ],
      "created_node_ids": [
        "sg_h2_math_collinearity_ratio"
      ],
      "practice_ids": [],
      "rationale_zh": "全库反向查重后，现有概念只能覆盖基础或更宽范围；新增一个与官方成果一致的最小可诊断概念，并保留相关 canonical 作为基础映射。",
      "evidence_refs": [
        {
          "source_id": "src_sg_seab_h2_math_9758_2026",
          "locator": "PDF p.7, collinearity; PDF p.8, ratio theorem, sub-topic 3.1"
        },
        {
          "source_id": "src_mit_ocw_18_02sc_fall_2010",
          "locator": "Unit 1 Part A, Sessions 1-4: vector components and geometric vector reasoning"
        }
      ],
      "review_status": "approved"
    },
    {
      "gap_id": "gap_sg_h2_math_9758_2026_o_point_line_plane_distance",